Date;PILIHAN;BREAKFAST;SHIFT 3;SHIFT 1;SHIFT 2
12/01/2024;PILIHAN 1;* Bakso komplit;Nasi Liwet Komplit, Paket Nasi Liwet, Tumis buncis, Tahu Gr.Bacem, Tempe Gr.Bacem, Kerupuk, Sambal Goang, Semangka;Nasi Liwet Komplit, Paket Nasi Liwet teri, Urap Sayuran, Perkedel kentang, Oseng tahu cabe ijo, Kerupuk, Sambal Goang, Semangka;Nasi Liwet Komplit, Paket Nasi Liwet, Sayur Asem Betawi, Kripik tempe, Tahu Bacem, Kerupuk, Sambal Goang, Semangka
12/01/2024;PILIHAN 2;* TLJ Chocolate cheese + Telur Rebus;Nasi Liwet Komplit, Ayam Gr Bawang Putih, Tumis buncis, Tahu Gr.Bacem, Tempe Gr.Bacem, Kerupuk, Sambal Goang, Semangka;Nasi Liwet Komplit, Ayam Gr Bawang Putih, Urap Sayuran, Perkedel kentang, Oseng tahu cabe ijo, Kerupuk, Sambal Goang, Semangka;Nasi Liwet Komplit, Ayam Gr Bawang Putih, Sayur Asem Betawi, Kripik tempe, Tahu Bacem, Kerupuk, Sambal Goang, Semangka, 
13/01/2024;PILIHAN 1;* Nasi Langgi;Nasi Putih, Ayam Suwir bb.kecap cb.ijo, cap cay kuah, Orek Tempe, Soun cb.ijo, Kerupuk, sambal tomat, Melon;Nasi Putih, Ayam Crispy Masak paprika, Sawi Putih cah wortel, sapo Tahu Tahu, Mie Goreng, Kerupuk, sambal tomat, Melon;Nasi Putih, Ayam Gr.Padang, Bening Bayam jg.manis, Kering Tempe, Terong balado, Kerupuk, sambal tomat, Melon
13/01/2024;PILIHAN 2;* Wonder Donut Gr. Isi Stroberry + Telur Rebus;Nasi Putih, Ikan Mas Bkr sbl. Kecap, cap cay kuah, Orek Tempe, Soun cb.ijo, Kerupuk, sambal tomat, Melon;Nasi Putih, Ikan mas Gr. Bb. Bali, Sawi Putih cah wortel, sapo Tahu Tahu, Mie Goreng, Kerupuk, sambal tomat, Melon;Nasi Putih, Ikan Mas Gr. Acar Kuning, Bening Bayam jg.manis, Kering Tempe, Terong balado, Kerupuk, sambal tomat, Melon, 
14/01/2024;PILIHAN 1;* Nasi Goreng Jawa;Nasi Putih, Sosis Gulung goreng telur, Tumis Lb. Siam wortel, Bakwan Sayur, Kering Kentang, Kerupuk, sambal Tomat, Pepaya;Nasi Putih, Telur dadar padang pedas, Gulai daun singkong, Tempe Gr. Kuning, Terong Balado, Kerupuk , sambal Tomat, Pepaya;Nasi Putih, Kekkian goreng telur, Bening Bayam jg.manis, Tahu gr.Bacem, Bal.Kentang + Buncis, Kerupuk, sambal Tomat, Pepaya
14/01/2024;PILIHAN 2;* Masuta Kcg Tanah Bunga + Telur Rebus;Nasi Putih, Kakap crispy saos singapore, Tumis Lb. Siam wortel, Bakwan Sayur, Kering Kentang, Kerupuk, sambal Tomat, Pepaya;Nasi Putih, Kakap gr. Tepung sambal ijo, Gulai daun singkong, Tempe Gr. Kuning, Terong Balado, Kerupuk , sambal Tomat, Pepaya;Nasi Putih, Kakap Gr. Tepung saus mayonaisse, Bening Bayam jg.manis, Tahu gr.Bacem, Bal.Kentang + Buncis, Kerupuk, sambal Tomat, Pepaya, 
15/01/2024;PILIHAN 1;* Nasi Uduk Komplit  (Telur dadar gulung polos, bihun goreng, kering tempe teri   kacang, sambal kacang, kerupuk);Nasi Putih, Ayam goreng Kremes, Sayur asem  betawi, Tempe Mendoan, Tahu Bacem, Kerupuk, Sambal tomat, Semangka;Nasi Putih, Chicken Fillet Gr.crispy Sc. Mentega, Bening Bayam Jg. Manis, Oseng tahu cb,ijo, Tempe Crispy, Kerupuk, Sambal Gr.Terasi, Semangka;Nasi Putih, Ayam bakar kecap madu, Tumis labu siam wortel, Tahu isi, Tumis Bihun Sayuran, Kerupuk, Sambal Cb. Hijau, Semangka
15/01/2024;PILIHAN 2;* My Roti Sandwich Coklat + Telur Rebus;Nasi Putih, Bandeng presto gr. Telur, Sayur asem  betawi, Tempe Mendoan, Tahu Bacem, Kerupuk, Sambal tomat, Semangka;Nasi Putih, Bandeng presto gr. Telur, Bening Bayam Jg. Manis, Oseng tahu cb,ijo, Tempe Crispy, Kerupuk, Sambal Gr.Terasi, Semangka;Nasi Putih, Bandeng Presto Gr. Kremes sbl. Korek, Tumis labu siam wortel, Tahu isi, Tumis Bihun Sayuran, Kerupuk, Sambal Cb. Hijau, Semangka, 
16/01/2024;PILIHAN 1;* Ketupat Sayur Padang  (Ayam goreng lengkuas, Gulai Lb. Siam + Tahu, Sambal Cb.    Merah, krupuk);Nasi Putih, Telur Ceplok Gongso, Cah tauge wortel , Tempe gr. Ketumbar, Kentang balado, Kerupuk, Sambal Rebus, Pisang;Nasi Putih, Telur Dadar Padang, Sayur lodeh jawa, Tempe bacem, Kering Kentang Kacang, Kerupuk, Sambal Terasi, Pisang;Nasi Putih, Telur asin, Soto ayam koya (soun, tauge, kol, wortel), Tempe Crispy, Bakwan jagung sayuran, Kerupuk, Sambal goreng terasi, Pisang
16/01/2024;PILIHAN 2;* Masuta Sisir Kcg Merah + Telur Rebus;Nasi Putih, Lele bkr. Sambal kecap, Cah tauge wortel , Tempe gr. Ketumbar, Kentang balado, Kerupuk, Sambal Rebus, Pisang;Nasi Putih, Lele goreng lengkuas sambal korek, Sayur lodeh jawa, Tempe bacem, Kering Kentang Kacang, Kerupuk, Sambal Terasi, Pisang;Nasi Putih, Lele gr. Lengkuas sbl. Korek, Soto ayam koya (soun, tauge, kol, wortel), Tempe Crispy, Bakwan jagung sayuran, Kerupuk, Sambal goreng terasi, Pisang, 
17/01/2024;PILIHAN 1;* Nasi goreng Rendang (Isian : orak arik telur, sosis sapi, bakso iris, krupuk udang, Acar Timun, Chicken karage );Nasi Uduk, Ayam Fillet Bb. Sate kacang, Bening Bayam Jgg. Manis, Kering Kentang, Tahu goreng telur, Kerupuk, Sambal Cb. Hijau, Melon;Nasi Putih, Ayam Gr. Mentega lada hitam, Cap cay kuah bakso, Balado tempe potong dadu, Soun cabe ijo, Kerupuk, Sambal Terasi, Melon;Nasi Putih, Ayam Goreng Crispy, Cp cay goreng bakso ikan, Balado kentang buncis, Tahu goreng telur, Kerupuk, Sambal Terasi, Melon
17/01/2024;PILIHAN 2;* Harvest Croissant Coklat + Telur Rebus;Nasi Uduk, Mujair Gr. Lengkuas, Bening Bayam Jgg. Manis, Kering Kentang, Tahu goreng telur, Kerupuk, Sambal Cb. Hijau, Melon;Nasi Putih, Mujair goreng kering sbl. Cobek, Cap cay kuah bakso, Balado tempe potong dadu, Soun cabe ijo, Kerupuk, Sambal Terasi, Melon;Nasi Putih, Mujair Gr. Kering sbl. Goang, Cp cay goreng bakso ikan, Balado kentang buncis, Tahu goreng telur, Kerupuk, Sambal Terasi, Melon, 
18/01/2024;PILIHAN 1;* Nasi Pecel Sayuran  (Isian : toge,kcg panjang, bayam, Wortel, Telur rebus, Tempe   goreng kuning, bb. Kcg, krupuk);Nasi Putih, Ayam Crispy Saus Tar-tar, ., Oseng Tempe Cb. Ijo, Tahu belah gr.tepung, Krupuk, sambal Tomat, Pepaya;Nasi Putih, Ayam Bakar Padang, Gulai kapau, Tempe gr.Kuning, Pergedel kentang, Krupuk, Sambal cb.Ijo Padang, Pepaya;Nasi Putih, Ayam Gr. Bawang Putih, Sayur asem betawi, Jamur crispy, tempe bacem, Krupuk, sambal Tomat, Pepaya
18/01/2024;PILIHAN 2;* Wonder Donut Gr. Topp. Coklat Almond + Telur Rebus;Nasi Putih, ikan mas Gr. Kering Bb. Bali, ., Oseng Tempe Cb. Ijo, Tahu belah gr.tepung, Krupuk, sambal Tomat, Pepaya;Nasi Putih, Ikan mas goreng lengkuas sambal ddabu-dabu, Gulai kapau, Tempe gr.Kuning, Pergedel kentang, Krupuk, Sambal cb.Ijo Padang, Pepaya;Nasi Putih, Ikan mas goreng sambal bumbu bali, Sayur asem betawi, Jamur crispy, tempe bacem, Krupuk, sambal Tomat, Pepaya, 
19/01/2024;PILIHAN 1;* Mi tek tek komplit  (mi telur, orak arik telur, caisim, kol, ayam suwir, Telur dadar  , kerupuk);Nasi Putih, Paket Sup Daging Sukiyaki, bawang, jeruk nipis), Kripik Tempe, Tahu Gr. Bawang Putih, Kerupuk, Sambal Kukus, Semangka;Nasi Putih, Paket Sup Daging Sukiyaki, bawang), Kripik Tempe, Tahu Gr. Bawang Putih, Kerupuk, Sambal Kukus, Semangka;Nasi Putih, Paket Sup Daging Sukiyaki, bawang), Kripik Tempe, Tahu Gr. Bawang Putih, Kerupuk, Sambal Kukus, Semangka
19/01/2024;PILIHAN 2;* TLJ Manis Kaya + Telur Rebus;Nasi Putih, (beef slice, wortel, kol, kentang, seledri, daun, bawang, jeruk nipis), Kripik Tempe, Tahu Gr. Bawang Putih, Kerupuk, Sambal Kukus, Semangka;Nasi Putih, (beef slice, wortel, kol, kentang, seledri, daun, bawang), Kripik Tempe, Tahu Gr. Bawang Putih, Kerupuk, Sambal Kukus, Semangka;Nasi Putih, (beef slice, wortel, kol, kentang, seledri, daun, bawang), Kripik Tempe, Tahu Gr. Bawang Putih, Kerupuk, Sambal Kukus, Semangka, 
20/01/2024;PILIHAN 1;* Nasi Rames Telur dadar,Oseng kcg panjang toge ,kering kentang mustofa, Sambal terasi, krupuk);Nasi Putih, Ayam Bakar Madu, Sawi Putih Cah Toge Wortel, Kentang Balado, Soun Goreng, Krupuk, Sambal tomat, Melon;Nasi Putih, Ayam Goreng Kremes, Bobor bayam labu siam, Tempe gr. Lengkuas, Soun Gr. Cb. Ijo, Krupuk, Sambal tomat, Melon;Nasi Putih, Ayam gr. Kecap, Cap Cay Goreng Bakso, Tempe Gr. Ketumbar, Pergedel Kentang, Krupuk, Sambal tomat, Melon
20/01/2024;PILIHAN 2;* Wonder Donut Gr. Icing + Telur Rebus* Milo, Kopi, Teh manis;Nasi Putih, Kembung Gr. Saus Padang, Sawi Putih Cah Toge Wortel, Kentang Balado, Soun Goreng, Krupuk, Sambal tomat, Melon;Nasi Putih, Kembung Sbl. Dabu - dabu, Bobor bayam labu siam, Tempe gr. Lengkuas, Soun Gr. Cb. Ijo, Krupuk, Sambal tomat, Melon;Nasi Putih, Kembung Balado, Cap Cay Goreng Bakso, Tempe Gr. Ketumbar, Pergedel Kentang, Krupuk, Sambal tomat, Melon, 
21/01/2024;PILIHAN 1;* Nasi Goreng Ikan Asin (Telur ceplok,acar timun,krupuk);Nasi Putih, Telur Gulung Isi Sosis, Soto Sayuran, Pergedel kentang, Kering Tempe, Kerupuk, Sambal Cb. Merah, Pepaya;Nasi Putih, Telur Dadar Pedas Bulat Kering, Gado - Gado, Tahu Gr. Belah Tepung, Bakwan Sayur, Kerupuk, Sambal Tomat, Pepaya;Nasi Putih, Fuyung Hai, Lodeh Jawa, Tempe Bacem, Tumis Terong Teri Medan, Kerupuk, Sambal Cb. Hijau, Pepaya
21/01/2024;PILIHAN 2;* Masuta Keju Susu + Telur Rebus* Milo, Kopi, Teh Manis;Nasi Putih, Bandeng Bakar Kecap, Soto Sayuran, Pergedel kentang, Kering Tempe, Kerupuk, Sambal Cb. Merah, Pepaya;Nasi Putih, Bandeng Goreng Balado, Gado - Gado, Tahu Gr. Belah Tepung, Bakwan Sayur, Kerupuk, Sambal Tomat, Pepaya;Nasi Putih, Bandeng Gr. Lengkuas, Lodeh Jawa, Tempe Bacem, Tumis Terong Teri Medan, Kerupuk, Sambal Cb. Hijau, Pepaya, 
